name,product_type,availability,price,original_price,discount_amount,discount_percentage,black_friday_discount,image,reviews_count,rating
"Samsung Celular Galaxy M15 5G Azul Claro 4GB RAM 128GB, Nacional con Garantía",smartphone,Available,"$2,475.23","$3,999.00","$1,523.77",38.10%,No,https://m.media-amazon.com/images/I/61dqezq8ZVL._AC_UL320_.jpg,316,4.6 de 5 estrellas
SAMSUNG Smartphone A05 4+128GB LTE Negro Dual SIM,smartphone,Available,"$1,969.00","$2,999.00","$1,030.00",34.34%,No,https://m.media-amazon.com/images/I/61UjBLFlH2L._AC_UL320_.jpg,159,4.3 de 5 estrellas
"SAMSUNG Galaxy A06 Negro 4GB RAM 64GB, Nacional con Garantía",smartphone,Available,"$1,829.00","$2,599.00",$770.00,29.63%,No,https://m.media-amazon.com/images/I/61Kpp0oa8kL._AC_UL320_.jpg,3,4.2 de 5 estrellas
"Samsung Celular Galaxy M55 5G Verde 8GB RAM 128GB, Nacional con Garantía",smartphone,Available,"$4,997.07","$7,999.00","$3,001.93",37.53%,No,https://m.media-amazon.com/images/I/61NGj+turzL._AC_UL320_.jpg,77,4.4 de 5 estrellas
"SAMSUNG Celular Galaxy M35 5G Azul Claro 6GB RAM 128GB, Nacional con Garantía",smartphone,Available,"$4,199.00","$5,499.00","$1,300.00",23.64%,No,https://m.media-amazon.com/images/I/61n3Td68iIL._AC_UL320_.jpg,73,4.7 de 5 estrellas
"Samsung Celular Galaxy A35 5G Violeta 6GB RAM 128GB, Nacional con Garantía",smartphone,Available,"$4,799.00","$6,299.00","$1,500.00",23.81%,No,https://m.media-amazon.com/images/I/61YAjWqc0DL._AC_UL320_.jpg,70,4.6 de 5 estrellas
"SAMSUNG Celular Galaxy A25 5G 8GB 256GB 6.5"" FHD+ 120 Hz 50 MP Blue Black",smartphone,Available,"$4,199.00","$4,199.00","$1,500.00",23.81%,No,https://m.media-amazon.com/images/I/61RVVxjv26L._AC_UL320_.jpg,56,4.4 de 5 estrellas
"Samsung Celular Galaxy A55 5G Azul Claro 8GB RAM 256GB, Nacional con Garantía",smartphone,Available,"$7,499.00","$8,999.00","$1,500.00",16.67%,No,https://m.media-amazon.com/images/I/61IW8xm4wXL._AC_UL320_.jpg,117,4.4 de 5 estrellas
"SAMSUNG Galaxy S24 FE 5G Grafito 8GB RAM 256GB, AI, Nacional con Garantía",smartphone,Available,"$11,829.09","$15,499.00","$3,669.91",23.68%,No,https://m.media-amazon.com/images/I/51+38FqDMGL._AC_UL320_.jpg,7,5.0 de 5 estrellas
SAMSUNG Galaxy A35 8GB 256GB 5G Negro,smartphone,Available,"$5,407.00","$5,407.00","$3,669.91",23.68%,No,https://m.media-amazon.com/images/I/61ljRHkT8DL._AC_UL320_.jpg,26,4.2 de 5 estrellas
"SAMSUNG Audifonos inalámbricos Galaxy Buds3 Blanco, AI, Nacional con Garantía",another,Available,"$1,799.00","$2,499.00",$700.00,28.01%,No,https://m.media-amazon.com/images/I/51wYLUl3sbL._AC_UL320_.jpg,58,4.6 de 5 estrellas
Samsung Galaxy A05S 4GB 128GB Violeta,smartphone,Available,"$2,999.00","$2,999.00",$700.00,28.01%,No,https://m.media-amazon.com/images/I/61+CTd3mcvL._AC_UL320_.jpg,12,4.1 de 5 estrellas
"SAMSUNG Galaxy S24 Ultra, Violeta, 12GB_256GB",smartphone,Available,"$20,699.00","$30,999.00","$10,300.00",33.23%,No,https://m.media-amazon.com/images/I/41R6PyAOtDL._AC_UL320_.jpg,142,4.6 de 5 estrellas
Samsung Galaxy Tab A9 4GB_64GB Color Gris,tablet,Available,"$2,499.00","$2,699.00",$200.00,7.41%,No,https://m.media-amazon.com/images/I/5169txVgFWL._AC_UL320_.jpg,657,4.6 de 5 estrellas
"Samsung Smart TV 50"" 4K Crystal UHD (UN50DU8000FXZX)",tv,Available,"$7,895.00","$14,284.00","$6,389.00",44.73%,No,https://m.media-amazon.com/images/I/61QkKCod-DL._AC_UL320_.jpg,16,5.0 de 5 estrellas
Samsung Galaxy A55 5G Color Violeta Claro RAM 8GB_128GB l Internacional,smartphone,Available,"$6,837.75","$6,837.75","$6,389.00",44.73%,No,https://m.media-amazon.com/images/I/51i4ME0cxeL._AC_UL320_.jpg,43,4.1 de 5 estrellas
SAMSUNG Celular Galaxy S23 128GB Rosa Claro,smartphone,Available,"$10,999.00","$15,999.00","$5,000.00",31.25%,No,https://m.media-amazon.com/images/I/61gpxn8wtoL._AC_UL320_.jpg,86,4.7 de 5 estrellas
Samsung Galaxy A15 (A155) Dual LTE 128GB 6GB RAM Negro,smartphone,Available,"$3,399.00","$3,399.00","$5,000.00",31.25%,No,https://m.media-amazon.com/images/I/41AmmeD4ypL._AC_UL320_.jpg,20,4.5 de 5 estrellas
Samsung Smartphone Galaxy A15 4G 6GB 128GB Negro Desbloqueado,smartphone,Available,"$3,799.00","$3,799.00","$5,000.00",31.25%,No,https://m.media-amazon.com/images/I/51jYEf9XY2L._AC_UL320_.jpg,x 12 meses sin intereses,No Rating
"SAMSUNG - Galaxy S21 Ultra G998U 5G, smartphone Android totalmente desbloqueado, versión de EE.UU., cámara de grado profesional, video 8K, 108 MP, 128 GB - Negro fantasma (reacondicionado)",smartphone,Available,"$6,947.84","$6,947.84","$5,000.00",31.25%,No,https://m.media-amazon.com/images/I/61dlAm9BpqL._AC_UL320_.jpg,"2,493",3.9 de 5 estrellas
QEXWSZS MLT-K706S Cartucho de Tóner Compatible para Samsung Reemplazos MLT-K706S Compatible para Samsung K7400LX K7500LX K7600LX,another,Available,"$2,901.00","$2,901.00","$5,000.00",31.25%,No,https://m.media-amazon.com/images/I/71FFCl0ncSL._AC_UL320_.jpg,Hasta 12 meses de,No Rating
QEXWSZS MLT-D704S Cartucho de Tóner Compatible para Samsung Reemplazos MLT-D704S Compatible para Samsung K3250NR K3300NR,another,Available,"$1,681.00","$1,681.00","$5,000.00",31.25%,No,https://m.media-amazon.com/images/I/715wGgLWr3L._AC_UL320_.jpg,Hasta 12 meses de,No Rating
"QEXWSZS CLT-K804S Cartucho de Tóner Compatible para Samsung Reemplazos CLT-K804S Compatible para Samsung X3220NR X3280NR,Black",another,Available,"$2,101.99","$2,101.99","$5,000.00",31.25%,No,https://m.media-amazon.com/images/I/71VC8BddyIL._AC_UL320_.jpg,Hasta 12 meses de,No Rating
QEXWSZS MLT-D708S Cartucho de Tóner Compatible para Samsung Reemplazos MLT-D708S Compatible para Samsung K4300LX K4350LX K4250RX,another,Available,"$1,201.00","$1,201.00","$5,000.00",31.25%,No,https://m.media-amazon.com/images/I/71cG5X2PVCL._AC_UL320_.jpg,Hasta 12 meses de,No Rating
"Samsung Adaptador de Corriente USB-C de 25W, Compacto, Negro",another,Available,$319.00,$399.00,$80.00,20.05%,No,https://m.media-amazon.com/images/I/51A6-bPbXGL._AC_UL320_.jpg,538,4.8 de 5 estrellas
"Samsung Galaxy S22 Ultra, 5G, desbloqueado de fábrica 128GB, SM-S908U1 (reacondicionado) (borgoña)",smartphone,Available,"$9,242.00","$9,242.00",$80.00,20.05%,No,https://m.media-amazon.com/images/I/61bteKquOYL._AC_UL320_.jpg,366,3.7 de 5 estrellas
SAMSUNG Galaxy A05S 4GB 128GB Negro,smartphone,Available,"$2,799.00","$2,799.00",$80.00,20.05%,No,https://m.media-amazon.com/images/I/61Srqk5BnTL._AC_UL320_.jpg,29,4.3 de 5 estrellas
"SAMSUNG Galaxy Tab A9+, 8GB RAM, 128GB, Color Gris Grafito",tablet,Available,"$3,980.00","$4,499.00",$519.00,11.54%,No,https://m.media-amazon.com/images/I/5128CkYTp5L._AC_UL320_.jpg,514,4.6 de 5 estrellas
"SAMSUNG Celular Galaxy S23 FE Menta 8GB RAM 256GB, AI, Nacional con Garantía",smartphone,Available,"$9,998.00","$12,999.00","$3,001.00",23.09%,No,https://m.media-amazon.com/images/I/41dLpiNFUfL._AC_UL320_.jpg,85,4.4 de 5 estrellas
"SAMSUNG Celular Galaxy A15 Negro 4GB RAM 128GB, Nacional con Garantía",smartphone,Available,"$3,398.00","$3,599.00",$201.00,5.58%,No,https://m.media-amazon.com/images/I/51mRnMaCDpL._AC_UL320_.jpg,108,4.5 de 5 estrellas
"Samsung Galaxy S20 5G, 128 GB, gris cósmicocompletamente desbloqueado (Reacondicionado)",smartphone,Available,"$4,597.00","$4,597.00",$201.00,5.58%,No,https://m.media-amazon.com/images/I/61uy0v+43CL._AC_UL320_.jpg,"5,978",4.2 de 5 estrellas
Samsung Smartphone Galaxy A15 4G 6GB 128GB Amarillo Desbloqueado,smartphone,Out of Stock,N/A,0,$201.00,5.58%,No,https://m.media-amazon.com/images/I/51cY-EaUOmL._AC_UL320_.jpg,1,4.0 de 5 estrellas
SAMSUNG Galaxy A55 8GB 128GB 5G Violeta,smartphone,Available,"$6,895.00","$6,895.00",$201.00,5.58%,No,https://m.media-amazon.com/images/I/611aVBz8yOL._AC_UL320_.jpg,6,3.9 de 5 estrellas
"SAMSUNG Galaxy S22 Ultra Smartphone, 512GB, 8K Camera & Video, Brightest Display, S Pen, Phantom Black (Reacondicionado)",smartphone,Available,"$11,630.38","$11,630.38",$201.00,5.58%,No,https://m.media-amazon.com/images/I/613Fp7fknhL._AC_UL320_.jpg,483,4.0 de 5 estrellas
"SAMSUNG Galaxy A05s Plateado, 4GB_128GB",smartphone,Available,"$2,589.00","$2,589.00",$201.00,5.58%,No,https://m.media-amazon.com/images/I/51SNnS5u43L._AC_UL320_.jpg,4,4.7 de 5 estrellas
SAMSUNG Galaxy A55 8Gb 128Gb 5g Negro,smartphone,Available,"$6,974.00","$7,499.00",$525.00,7.00%,No,https://m.media-amazon.com/images/I/614AjVGG4FL._AC_UL320_.jpg,14,5.0 de 5 estrellas
SAMSUNG Galaxy A06 4GB 128GB Azul,smartphone,Available,"$2,389.00","$2,389.00",$525.00,7.00%,No,https://m.media-amazon.com/images/I/41ufMoRD0oL._AC_UL320_.jpg,x 12 meses sin intereses,No Rating
"Samsung Galaxy A05 Verde Claro, 4GB_64GB l Internacional",smartphone,Available,"$2,052.00","$2,052.00",$525.00,7.00%,No,https://m.media-amazon.com/images/I/71gwC+4xZSL._AC_UL320_.jpg,54,4.4 de 5 estrellas
"SAMUNG Pantalla Led 75"" Procesador Crystal 4K, SmartThings Mod.UN75CU7000DXZA RENOVADO (75"")",another,Available,"$15,500.00","$15,500.00",$525.00,7.00%,No,https://m.media-amazon.com/images/I/61TMAyFBSmL._AC_UL320_.jpg,4,3.8 de 5 estrellas
"Samsung Galaxy S20 FE 5G | Teléfono celular Android desbloqueado de fabrica | 128 GB | version de EE. UU. | Camara de grado profesional, zoom espacial 30X, modo nocturno | Cloud Navy (Reacondicionado)",smartphone,Available,"$4,184.00","$17,499.69","$13,315.69",76.09%,No,https://m.media-amazon.com/images/I/51X7xr4MQNL._AC_UL320_.jpg,"4,106",4.2 de 5 estrellas
"SAMSUNG Galaxy Tab S9 FE+ - Tablet Android, 12.4 Pulgadas, 256 GB, 8MP, IP68, batería de Larga duración, procesador Potente, S Pen, cámara de 8 MP, para E.E.U.U., Color Lavanda",tablet,Available,"$12,597.35","$16,459.00","$3,861.65",23.46%,No,https://m.media-amazon.com/images/I/513outQrR4L._AC_UL320_.jpg,"2,062",4.6 de 5 estrellas
"SAMSUNG Galaxy Watch6 Classic 47mm Negro, Nacional con Garantía",watch,Available,"$3,799.00","$7,199.00","$3,400.00",47.23%,No,https://m.media-amazon.com/images/I/61s77epX5QL._AC_UL320_.jpg,509,4.5 de 5 estrellas
SAMSUNG Galaxy A35 8GB 128GB 5G Azul,smartphone,Available,"$5,389.00","$5,389.00","$3,400.00",47.23%,No,https://m.media-amazon.com/images/I/61V6LOJWISL._AC_UL320_.jpg,1,5.0 de 5 estrellas
Samsung Smartphone A25 8+256GB 5G Azul Dual SIM,smartphone,Out of Stock,N/A,0,"$3,400.00",47.23%,No,https://m.media-amazon.com/images/I/51i2bWQ8xxL._AC_UL320_.jpg,119,4.0 de 5 estrellas
"SAMSUNG Galaxy Z Flip 3 5G, versión estadounidense, 128GB, negro fantasma - desbloqueado (reacondicionado)",smartphone,Available,"$6,881.85","$6,881.85","$3,400.00",47.23%,No,https://m.media-amazon.com/images/I/61JXIlARNfL._AC_UL320_.jpg,"1,556",3.7 de 5 estrellas
"SAMSUNG - Galaxy Buds2 Pro - Auriculares inalámbricos, Bluetooth, Morado Bora (reacondicionados)",smartphone,Available,"$1,933.28","$1,933.28","$3,400.00",47.23%,No,https://m.media-amazon.com/images/I/51DzUEvJPDL._AC_UL320_.jpg,991,4.2 de 5 estrellas
"SAMSUNG Galaxy S21 FE 5G, versión de EE. UU., 128 GB, azul marino, desbloqueado (reacondicionado)",smartphone,Available,"$5,220.51","$5,846.55",$626.04,10.71%,No,https://m.media-amazon.com/images/I/91gKJze6DQL._AC_UL320_.jpg,91,4.3 de 5 estrellas
"Samsung Galaxy Tab S9 Beige 12GB RAM 256GB, AI, Spen, Nacional con Garantía",tablet,Out of Stock,N/A,0,$626.04,10.71%,No,https://m.media-amazon.com/images/I/510bCXNfAZL._AC_UL320_.jpg,641,4.8 de 5 estrellas
"SAMSUNG Galaxy Z Flip 4 SM-F721U1 - Desbloqueado de fábrica (128 GB, color morado bora)",smartphone,Available,"$8,263.51","$8,263.51",$626.04,10.71%,No,https://m.media-amazon.com/images/I/51cMSayAObL._AC_UL320_.jpg,412,4.3 de 5 estrellas
""" SAMSUNG - Teléfono móvil Android Galaxy Z Fold 3 5G desbloqueado de fábrica, teléfono inteligente 2 en 1, doble pantalla, cámara debajo de la pantalla, 256 GB de almacenamiento, Phantom Black""",another,Available,"$10,517.00","$10,517.00",$626.04,10.71%,No,https://m.media-amazon.com/images/I/71MFE2UY6-L._AC_UL320_.jpg,967,3.8 de 5 estrellas
"Samsung Galaxy A15 Dual Sim 128GB Light Blue 6GB Ram Desbloqueado 6.5""",smartphone,Available,"$3,399.00","$4,000.00",$601.00,15.02%,No,https://m.media-amazon.com/images/I/51rp0nqaPoL._AC_UL320_.jpg,"1,181",4.6 de 5 estrellas
"Eynshoo Cargador Tipo C, Cargador 45W Carga Rápida, para Galaxy S24 Ultra/S24+/S24/S23 Ultra/S23+/S23/S22+/S22/S21+/Note 10+/Note 20/S20, Galaxy Tab S10/S9/S8, con un Cable de 1,8mtr",tablet,Available,$183.91,$249.00,$65.09,26.14%,No,https://m.media-amazon.com/images/I/51tZmKyzHKL._AC_UL320_.jpg,217,4.5 de 5 estrellas
"Anker Zolo Power Bank, Cable TipoC y Lightning Integrado, 20000mAh, Carga rápida de 30W, Certificación MFI, Compacto y portátil, Compatible con iPhone 11/12/13/14/15 y Samsung Serie y Andrioid",smartphone,Available,$799.20,$999.00,$199.80,20.00%,No,https://m.media-amazon.com/images/I/61cs70QNRxL._AC_UL320_.jpg,368,4.6 de 5 estrellas
QEXWSZS SF-D560RA Cartucho de Tóner Compatible para Samsung Reemplazos SF-D560RA Compatible para Samsung SF-560R 560RC 565PR 565PRC,another,Available,"$1,101.00","$1,101.00",$199.80,20.00%,No,https://m.media-amazon.com/images/I/71z8dRHbM+L._AC_UL320_.jpg,Hasta 12 meses de,No Rating
QEXWSZS ML-D3470A Cartucho de Tóner Compatible para Samsung Reemplazos ML-D3470A Compatible para Samsung ML-3470D 3471ND,another,Available,"$1,141.00","$1,141.00",$199.80,20.00%,No,https://m.media-amazon.com/images/I/71f4gj3WzTL._AC_UL320_.jpg,Hasta 12 meses de,No Rating
QEXWSZS MLT-D304E Cartucho de Tóner Compatible para Samsung Reemplazos MLT-D304E Compatible para Samsung SL-M4583FX M4530NX,another,Available,"$2,351.00","$2,351.00",$199.80,20.00%,No,https://m.media-amazon.com/images/I/71NGrxnKaIL._AC_UL320_.jpg,Hasta 12 meses de,No Rating
"QEXWSZS CLT-K808S Cartucho de Tóner Compatible para Samsung Reemplazos CLT-K808S Compatible para Samsung X4300LX X4250LX X4220RX,Combination",another,Available,"$7,358.99","$7,358.99",$199.80,20.00%,No,https://m.media-amazon.com/images/I/71nt5QcLBDL._AC_UL320_.jpg,Hasta 12 meses de,No Rating
Cartuchos de tóner MLT-D708S con Chip de Repuesto para Samsung MLT-D708S Cartucho de tóner Funciona con Impresora para Samsung MLT-D708S,another,Available,"$1,095.99","$1,095.99",$199.80,20.00%,No,https://m.media-amazon.com/images/I/71wfCIf7A9L._AC_UL320_.jpg,Hasta 12 meses de,No Rating
QEXWSZS ML-D3050A Cartucho de Tóner Compatible para Samsung Reemplazos ML-D3050A Compatible para Samsung ML-3050 3051N 3051ND,another,Available,"$1,201.00","$1,201.00",$199.80,20.00%,No,https://m.media-amazon.com/images/I/71nHgZ-4ruL._AC_UL320_.jpg,Hasta 12 meses de,No Rating
QEXWSZS MLT-D303E Cartucho de Tóner Compatible para Samsung Reemplazos MLT-D303E Compatible para Samsung SL-M4580FX,another,Available,"$2,501.00","$2,501.00",$199.80,20.00%,No,https://m.media-amazon.com/images/I/71oghmmOMtL._AC_UL320_.jpg,Hasta 12 meses de,No Rating
