name,product_type,availability,price,original_price,discount_amount,discount_percentage,black_friday_discount,image,reviews_count,rating
Samsung Galaxy Tab A9 4GB_64GB Color Plata,tablet,Available,"$2,349.00","$2,699.00",$350.00,12.97%,No,https://m.media-amazon.com/images/I/51mpj160tuL._AC_UL320_.jpg,653,4.6 de 5 estrellas
"SAMSUNG Galaxy Tab S9 FE Gris 8GB RAM 256GB, Spen, Smart Book Cover, Nacional con Garantía",tablet,Available,"$7,199.00","$8,999.00","$1,800.00",20.00%,No,https://m.media-amazon.com/images/I/416-omnWfEL._AC_UL320_.jpg,999,4.7 de 5 estrellas
"SAMSUNG Galaxy Tab A9+, 8GB RAM, 128GB, Color Gris Grafito",tablet,Available,"$4,499.00","$4,499.00","$1,800.00",20.00%,No,https://m.media-amazon.com/images/I/5128CkYTp5L._AC_UL320_.jpg,505,4.6 de 5 estrellas
"SAMSUNG Galaxy Tab A9+ Plata 8GB RAM 128GB, Nacional con Garantía",tablet,Available,"$4,499.00","$4,499.00","$1,800.00",20.00%,No,https://m.media-amazon.com/images/I/51hk7s97ZNL._AC_UL320_.jpg,238,4.6 de 5 estrellas
"SAMSUNG Tablet Galaxy Tab A9 8.7"" 8GB 128GB Octa Core MEDIATEK Helio G99 Android 13 Gris SM-X110NZAEL06 Garantia con Fabricante",tablet,Available,"$3,489.00","$3,489.00","$1,800.00",20.00%,No,https://m.media-amazon.com/images/I/41FPVH0pbUL._AC_UL320_.jpg,15,4.9 de 5 estrellas
Samsung Galaxy Tab S6 Lite 2024 Color Rosa RAM 4GB 128GB,tablet,Out of Stock,N/A,0,"$1,800.00",20.00%,No,https://m.media-amazon.com/images/I/31zTjUDn2oL._AC_UL320_.jpg,361,4.5 de 5 estrellas
"SAMSUNG Tablet Galaxy Tab A9+ 11"" 4GB 64GB Octa Core Android 13 Plata SM-X210NZSAMXO Garantia con Fabricante",tablet,Available,"$3,199.00","$3,199.00","$1,800.00",20.00%,No,https://m.media-amazon.com/images/I/31-L9Nu8vjL._AC_UL320_.jpg,1,5.0 de 5 estrellas
"SAMSUNG Galaxy Tab A9+ (SM-X210), 64GB 4GB RAM, solo WiFi, visualización de 11 pulgadas, versión internacional - (grafito)",tablet,Available,"$3,199.00","$3,199.00","$1,800.00",20.00%,No,https://m.media-amazon.com/images/I/51RPJ0gPSXL._AC_UL320_.jpg,18,3.6 de 5 estrellas
"Samsung Galaxy Tab S9 Beige 12GB RAM 256GB, AI, Spen, Nacional con Garantía",tablet,Available,"$10,399.00","$12,999.00","$2,600.00",20.00%,No,https://m.media-amazon.com/images/I/510bCXNfAZL._AC_UL320_.jpg,636,4.8 de 5 estrellas
"Samsung Galaxy Tab S10 Ultra Gris 12GB RAM 256GB, AI, Spen, 1 año con Garantía",tablet,Available,"$15,999.00","$26,999.00","$11,000.00",40.74%,No,https://m.media-amazon.com/images/I/41LEJycnrwL._AC_UL320_.jpg,100+ comprados el mes pasado,No Rating
"Samsung Galaxy Tab A9+ Tablet Android de 11 pulgadas de 64 GB, visualización grande, altavoces cuádruple, chipset mejorado, visualización multiventana, delgado, ligero, diseño duradero, versión de EE.",tablet,Available,"$3,754.09","$3,999.00",$244.91,6.12%,No,https://m.media-amazon.com/images/I/61d46oYQgdL._AC_UL320_.jpg,"7,137",4.5 de 5 estrellas
"Samsung Galaxy Tab S6 Lite (2024) 10.4' 128GB WiFi Android Tablet, S Pen incluido, listo para juegos, batería de larga duración, diseño de metal delgado, almacenamiento expandible, versión de EE. UU.,",tablet,Available,"$6,298.57","$6,298.57",$244.91,6.12%,No,https://m.media-amazon.com/images/I/71-hJGtkLWL._AC_UL320_.jpg,"1,027",4.5 de 5 estrellas
"Lenovo Tab M11 | 11"" WUXGA MediaTek Helio G88 8GB RAM 128GB | 4 Speakers Dolby Atmos, Cámara 8.0MP Frontal 8.0MP | Android 13, Incluye Folio Case Tab Pen Plus",tablet,Available,"$4,027.24","$4,699.00",$671.76,14.30%,No,https://m.media-amazon.com/images/I/71ezLwZc4gL._AC_UL320_.jpg,95,4.5 de 5 estrellas
"SAMSUNG Galaxy Tab S6 Lite - 10.4"", 64 GB, tableta Android con batería de larga duración, S Pen incluida, diseño metálico delgado, doble bocina AKG, gris Oxford (Reacondicionada)",tablet,Available,"$4,369.31","$4,369.31",$671.76,14.30%,No,https://m.media-amazon.com/images/I/718B6zl+b6L._AC_UL320_.jpg,438,4.4 de 5 estrellas
"SAMSUNG Galaxy Tab A9 (SM-X115), 64GB 4GB RAM, 4G LTE + WiFi, GSM desbloqueado de fábrica, versión internacional (azul marino)",tablet,Available,"$3,427.41","$3,427.41",$671.76,14.30%,No,https://m.media-amazon.com/images/I/51sbL5feI7L._AC_UL320_.jpg,4,4.4 de 5 estrellas
"SAMSUNG- Galaxy Tab S6 Lite (2024) - Gris 10.4” 128GB WiFi Android Tablet W/s Pen, Altavoces Duales, 8MP+5MP",tablet,Available,"$5,694.09","$5,694.09",$671.76,14.30%,No,https://m.media-amazon.com/images/I/61vsK7h3zVL._AC_UL320_.jpg,34,4.2 de 5 estrellas
"SAMSUNG Galaxy Tab S9 FE+ Plus Tablet Android de 12.4 Pulgadas y 256 GB, batería de Larga duración, procesador Potente, lápiz S, cámara de 8 MP, diseño Ligero y Duradero, Almacenamiento expandible,",tablet,Available,"$12,597.35","$16,459.00","$3,861.65",23.46%,No,https://m.media-amazon.com/images/I/61VWKpk0YzL._AC_UL320_.jpg,"2,039",4.6 de 5 estrellas
"Lenovo Tab P12 | 12.7"" 3K | 8GB + 256GB MediaTek Dimensity 7050 | Cámara 13 MP Altavoces JBL | Android 13",tablet,Out of Stock,N/A,0,"$3,861.65",23.46%,No,https://m.media-amazon.com/images/I/51SF34dhsZL._AC_UL320_.jpg,94,4.8 de 5 estrellas
"SAMSUNG Galaxy Tab S6 Lite P620 10.4"" 4GB 64GB WiFi Menta",tablet,Available,"$5,299.00","$5,299.00","$3,861.65",23.46%,No,https://m.media-amazon.com/images/I/518WKY1HJgL._AC_UL320_.jpg,Hasta 12 meses de,No Rating
"Lenovo Tab M10 | 10.1"" WUXGA Unisoc T610 4GB RAM 64GB | Dual Speaker Dolby Atmos, Cámara 8.0MP Frontal 5.0MP | Android 11",tablet,Available,"$3,498.89","$3,899.00",$400.11,10.26%,No,https://m.media-amazon.com/images/I/61lnNweFKVL._AC_UL320_.jpg,57,4.2 de 5 estrellas
SAMSUNG Galaxy-Z Fold4 12GB + 512GB Beige (Reacondicionado),another,Available,"$16,490.00","$21,639.00","$5,149.00",23.79%,No,https://m.media-amazon.com/images/I/71+YFxl7f8L._AC_UL320_.jpg,Precio Nuevo:,No Rating
"HEUCYL Funda con Teclado Táctil para Samsung Galaxy Tab A9 Plus 11 Pulgadas 2023 (SM-X210/X216/X218), Teclado Bluetooth Desmontable Retroiluminado 7 Colores, Funda Delgada con Soporte,Purple",case,Available,$610.89,$610.89,"$5,149.00",23.79%,No,https://m.media-amazon.com/images/I/61KWwahKxNL._AC_UL320_.jpg,4,3.5 de 5 estrellas
"YAPANIZCEL Funda Compatible con Samsung Galaxy Tab A9 8.7"" (SM-X115N, SM-X110N) 8.7 Pulgadas, Soporte lápiz S Pen + Stand, Correa Uso rudo Reforzada (Rojo)",case,Available,$351.12,$399.00,$47.88,12.00%,No,https://m.media-amazon.com/images/I/71N9cKlkqlL._AC_UL320_.jpg,24,4.9 de 5 estrellas
"Yoidesu Tableta de 10 Pulgadas para Android 11, 12GB 128GB ROM 5G WiFi 4G Calling Tablet, 8 Processor 1960x1080 FHD IPS Screen, 7000mAh Battery, 8MP 16MP Camera, Night Reading",tablet,Available,"$2,265.00","$2,265.00",$47.88,12.00%,No,https://m.media-amazon.com/images/I/61HMeXhHR4L._AC_UL320_.jpg,1,5.0 de 5 estrellas
"Tablet Samsung Galaxy Tab S8 Android, visualización LCD de 11 pulgadas, almacenamiento de 128 GB, productividad DeX, Qualcomm Snapdragon, S Pen incluido, batería para todo el día, cámara ultra ancha,",tablet,Available,"$7,748.40","$7,748.40",$47.88,12.00%,No,https://m.media-amazon.com/images/I/61oBVRcipDL._AC_UL320_.jpg,207,4.4 de 5 estrellas
Tableta Galaxy-Tab-A9 8.7 INC 8GB 128 GB Silver WiFi Samsung,tablet,Available,"$3,399.00","$3,399.00",$47.88,12.00%,No,https://m.media-amazon.com/images/I/51MTx42E4GL._AC_UL320_.jpg,24,4.1 de 5 estrellas
Samsung Tablet Galaxy S9 FE 8GB 256GB Gris,tablet,Out of Stock,N/A,0,$47.88,12.00%,No,https://m.media-amazon.com/images/I/41pB+CA05qL._AC_UL320_.jpg,69,4.2 de 5 estrellas
"SAMSUNG Galaxy Tab S6 Lite 2024 (128 GB, incluye S-Pen y cubierta de libro) 10.4 pulgadas Full HD, Android 14, modo Dex, Exynos 1280 5nm, batería todo el día Wi-Fi Tablet SM-P620 Modelo internacional",tablet,Available,"$6,770.33","$6,770.33",$47.88,12.00%,No,https://m.media-amazon.com/images/I/51o9v6+jiTL._AC_UL320_.jpg,5,4.5 de 5 estrellas
"Samsung Galaxy Tab S7 (tableta 5G) LTE/WiFi (AT&T), Mystic Black - 128 GB (modelo 2020 - Versión de EE. UU. y garantía) - SM-T878UZKAATT (renovado)",tablet,Available,"$6,234.03","$6,234.03",$47.88,12.00%,No,https://m.media-amazon.com/images/I/41OeG8nbhYS._AC_UL320_.jpg,11,4.0 de 5 estrellas
"SAMSUNG Galaxy Tab A9 4G LTE (64 GB, 4 GB, Celular) Tablet Android de 8.7 Pulgadas, Octa-Core (6 NM), Altavoces Dobles (Modelo Internacional Totalmente Desbloqueado para Mexico y Global) X115",tablet,Available,"$3,468.81","$3,468.81",$47.88,12.00%,No,https://m.media-amazon.com/images/I/51HL5sz4keL._AC_UL320_.jpg,57,4.3 de 5 estrellas
"SAMSUNG Galaxy Tab A9+ 11 pulgadas 64GB Wi-Fi Android Tablet, visualización grande, altavoces cuádruple, chipset mejorado, visualización multiventana, diseño delgado, ligero, duradero, versión de EE.",tablet,Available,"$3,556.09","$3,556.09",$47.88,12.00%,No,https://m.media-amazon.com/images/I/51OMSBpi6mL._AC_UL320_.jpg,16,4.5 de 5 estrellas
"SAMSUNG Galaxy Tab S7 FE 128 GB 12.4"" visualización WiFi Android Tablet - Mystic Green (reacondicionado)",tablet,Available,"$6,307.11","$6,307.11",$47.88,12.00%,No,https://m.media-amazon.com/images/I/81wfWokJJPL._AC_UL320_.jpg,4,5.0 de 5 estrellas
"SAMSUNG Tablet A7 Lite 32Gb 8.7"" Gris SM-T220NZAAXAR",tablet,Out of Stock,N/A,0,$47.88,12.00%,No,https://m.media-amazon.com/images/I/819hAP4xoGS._AC_UL320_.jpg,"14,493",4.7 de 5 estrellas
"Samsung Galaxy Tab A9 (SM-X110), 64GB 4GB RAM, solo WiFi, versión internacional (paquete de cargador de pared de 15W) (gris)",tablet,Available,"$3,035.78","$3,035.78",$47.88,12.00%,No,https://m.media-amazon.com/images/I/51HL5sz4keL._AC_UL320_.jpg,203,3.8 de 5 estrellas
Samsung Tab A7 Lite 8.7 Gris 32GB (SM-T220NZAAXAR) (Reacondicionado),tablet,Available,"$2,278.84","$2,278.84",$47.88,12.00%,No,https://m.media-amazon.com/images/I/819hAP4xoGS._AC_UL320_.jpg,706,4.1 de 5 estrellas
"Apple iPad, 10.2 pulgadas, Wi-Fi, último modelo, , Wi-Fi, Gris espacial, 32 GB SSD(Reacondicionado)",another,Available,"$4,075.15","$4,075.15",$47.88,12.00%,No,https://m.media-amazon.com/images/I/81IjVvOXGdL._AC_UL320_.jpg,"8,229",4.2 de 5 estrellas
"Samsung Galaxy Tab S7 FE 12.4"" 128GB T733 WiFi solo (reacondicionado)",tablet,Available,"$5,739.20","$6,420.43",$681.23,10.61%,No,https://m.media-amazon.com/images/I/81pvrghQpzL._AC_UL320_.jpg,24,4.7 de 5 estrellas
"SAMSUNG Galaxy Tab S7 FE 2021 - Tablet Android de 12.4 Pulgadas, WiFi 64 GB, bolígrafo S Incluido batería de Larga duración, Rendimiento Potente, Negro místico (reacondicionado)",tablet,Available,"$6,303.85","$6,303.85",$681.23,10.61%,No,https://m.media-amazon.com/images/I/91pjZAMbEUS._AC_UL320_.jpg,618,4.4 de 5 estrellas
"SAMSUNG Galaxy Tab A9 (64 GB, 4 GB, solo Wi-Fi) tablet Android de 8.7 pulgadas, batería todo el día, octa-core (6 nm), altavoces duales, modelo internacional - X110 (paquete SD de 256 GB, azul marino)",tablet,Available,"$2,449.00","$2,709.90",$260.90,9.63%,No,https://m.media-amazon.com/images/I/517v9A8k0RL._AC_UL320_.jpg,103,4.0 de 5 estrellas
Samsung Tablet Galaxy Tab A9 64gb Almacenamiento 4Gb Ram Color Navy,tablet,Available,"$3,035.24","$3,035.24",$260.90,9.63%,No,https://m.media-amazon.com/images/I/51LoFBO2UlL._AC_UL320_.jpg,240,4.2 de 5 estrellas
"UGEE UT3 Fun Drawing Pad 14,25 Pulgadas, Tablet Android 14, 8GB + 256GB, 2.4K Ultra HD Pantalla Grande, Tableta Android de Ocho Núcleos, 10000mAh, 27W Carga Rápida",tablet,Available,"$7,999.00","$7,999.00",$260.90,9.63%,No,https://m.media-amazon.com/images/I/61bu-sDmcfL._AC_UL320_.jpg,3,5.0 de 5 estrellas
"Samsung Galaxy Tab A T307U 8.4 pulgadas Tablet 32GB WiFi + 4G LTE Verizon desbloqueado 1.8GHz, Mocha (reacondicionado)",tablet,Available,"$2,279.68","$2,279.68",$260.90,9.63%,No,https://m.media-amazon.com/images/I/61iAtKMpGnL._AC_UL320_.jpg,6,3.7 de 5 estrellas
"SAMSUNG Galaxy Tab A SM-T387 8"" Tablet - 32 GB Storage - WiFi and Verizon 4G - Black - (Renewed)",tablet,Available,"$1,548.32","$1,548.32",$260.90,9.63%,No,https://m.media-amazon.com/images/I/81tytTAqCOL._AC_UL320_.jpg,385,3.6 de 5 estrellas
"Samsung Galaxy Tab S7 FE 2021 - Tablet Android de 12.4 pulgadas, visualización LTE/WiFi (Verizon) 64 GB S Pen incluido batería de larga duración, rendimiento potente, negro místico, SM-T738UZKAVZW",tablet,Available,"$5,776.75","$5,776.75",$260.90,9.63%,No,https://m.media-amazon.com/images/I/411RRAPdlHL._AC_UL320_.jpg,51,3.8 de 5 estrellas
"SAMSUNG Galaxy Tab S9+ Plus 12.4 pulgadas 512 GB, tablet WiFi 6E Android, procesador Snapdragon 8 Gen2, visualización AMOLED, bolígrafo S, clasificación IP68, versión de EE. UU., 2023, grafito",tablet,Out of Stock,N/A,0,$260.90,9.63%,No,https://m.media-amazon.com/images/I/71RXkwrLY4L._AC_UL320_.jpg,14,4.5 de 5 estrellas
"SAMSUNG Samsung Galaxy Tab S8+ Plus con lápiz S de baja latencia (128 GB, 8 GB) 12.4 pulgadas 120 Hz AMOLED, Snapdragon 8 (4 nm), batería todo el día, tablet Android 12 Wi-Fi SM-X800 modelo",tablet,Available,"$9,885.36","$9,885.36",$260.90,9.63%,No,https://m.media-amazon.com/images/I/814KnXVtcsL._AC_UL320_.jpg,212,4.4 de 5 estrellas
"SAMSUNG Galaxy Tab S6 Lite 10.4"" 64GB (modelo 2024 - versión internacional) WiFi Android Tablet con S Pen (gris Oxford)",tablet,Available,"$5,535.47","$5,535.47",$260.90,9.63%,No,https://m.media-amazon.com/images/I/61nMpE8xRrL._AC_UL320_.jpg,x 12 meses sin intereses,No Rating
"SAMSUNG Tablet Galaxy Tab A9+ 11"" 4GB 64GB Octa Core Android 13 Gris SM-X210NZAAMXO Garantia con Fabricante",tablet,Available,"$3,549.00","$3,549.00",$260.90,9.63%,No,https://m.media-amazon.com/images/I/51G-9TUm1uL._AC_UL320_.jpg,x 12 meses sin intereses,No Rating
"Samsung Galaxy Tab A 8.4"" 32GB, moca SM-T307UZNATMB (2020) - T-Mobile (Reacondicionado)",tablet,Available,"$1,970.12","$1,970.12",$260.90,9.63%,No,https://m.media-amazon.com/images/I/61Srd7vM0sL._AC_UL320_.jpg,53,3.9 de 5 estrellas
"Samsung Galaxy Tab S9 FE+ 12.4 pulgadas 256 GB+12 GB RAM Android Tablet, IP68 resistente al agua y al polvo, batería de larga duración, lápiz S, cámara de 8 MP, 2023 (gris)",tablet,Available,"$13,072.53","$13,072.53",$260.90,9.63%,No,https://m.media-amazon.com/images/I/415C4cU8YML._AC_UL320_.jpg,9,3.7 de 5 estrellas
"Acer Tablet ICONIA Tab A10 10.1"", 4 GB RAM, 64 GB, Android 12, Mediatek MTK MT8168, Quad-Core Arm",tablet,Available,"$1,799.00","$1,799.00",$260.90,9.63%,No,https://m.media-amazon.com/images/I/51VG-vm5MiL._AC_UL320_.jpg,18,4.2 de 5 estrellas
"SAMSUNG - Tableta Galaxy Tab S6 Lite de 10,4 Pulgadas, 64 GB, WiFi, Gris Oxford, SM-P610NZAAXAR, S Pen Incluido (renovado)",tablet,Available,"$4,096.51","$4,096.51",$260.90,9.63%,No,https://m.media-amazon.com/images/I/61-gynMDmiL._AC_UL320_.jpg,820,4.4 de 5 estrellas
"YAPANIZCEL 2 Micas Cristal templado para Samsung Galaxy Tab A9 8.7""(SM-X110, SM-X115), Mica Screen Protector Transparente Vidrio Cristal Templado de Pantalla. (2 Micas)",tablet,Available,$175.99,$199.99,$24.00,12.00%,No,https://m.media-amazon.com/images/I/61GXNxbUz9L._AC_UL320_.jpg,1,5.0 de 5 estrellas
"YAPANIZCEL 2 Micas Cristal templado para Samsung Galaxy Tab A8 10.5 2022 Sm X200/205/207, Mica 10.5"" Screen Protector Transparente Vidrio Cristal Templado de Pantalla (2 Micas)",tablet,Available,$175.00,$199.99,$24.99,12.50%,No,https://m.media-amazon.com/images/I/81zTP9BKpNL._AC_UL320_.jpg,Anterior:,No Rating
"YAPANIZCEL 2 Micas Cristal templado para Samsung Galaxy Tab A7 Lite, Mica Screen Protector Transparente Vidrio Cristal Templado de Pantalla (2 Micas)",tablet,Available,$175.99,$199.99,$24.00,12.00%,No,https://m.media-amazon.com/images/I/7193VrYAG9L._AC_UL320_.jpg,1,5.0 de 5 estrellas
"YAPANIZCEL Mica Cristal templado para Samsung Galaxy Tab A9 8.7""(SM-X110, SM-X115), Mica Screen Protector Transparente Vidrio Cristal Templado de Pantalla",tablet,Available,$199.00,$199.00,$24.00,12.00%,No,https://m.media-amazon.com/images/I/61Y+INIYBTL._AC_UL320_.jpg,13,4.3 de 5 estrellas
"YAPANIZCEL Mica Cristal templado para Samsung Galaxy Tab A9+ Plus 11"" (SM-X210, SM-X216) Mica Screen Protector Transparente Vidrio Cristal Templado de Pantalla",tablet,Available,$199.00,$199.00,$24.00,12.00%,No,https://m.media-amazon.com/images/I/618skGpbTmL._AC_UL320_.jpg,22,4.0 de 5 estrellas
"Funda para Samsung Tab A9 Plus 2023:Resistente Resistente Grado Militar a Prueba de Golpes para Galaxy Tab A9 + 11 Pulgadas 2023 con Soporte de 360°, asa - Correa para el Hombro, Soporte para lápices",case,Available,$599.99,$599.99,$24.00,12.00%,No,https://m.media-amazon.com/images/I/71ZyXcyc7aL._AC_UL320_.jpg,93,4.5 de 5 estrellas
"Simpeak 2 Piezas Protector Pantalla Compatible con Samsung Galaxy Tab A9 8.7"", Mica Tablet HD Cristal Película Templado Premium Complet Compatible con Galaxy Tab A9 2023 [No Bubble][Anti-Huella]",tablet,Available,$239.99,$239.99,$24.00,12.00%,No,https://m.media-amazon.com/images/I/61qf17FAlrL._AC_UL320_.jpg,167,4.6 de 5 estrellas
"YAPANIZCEL Funda Compatible con Samsung Galaxy Tab A9 2023 8.7"" (SM-X115N, SM-X110N), Compuesta de 3 Piezas, Stand Uso rudo (Rosa)",case,Available,$313.20,$399.00,$85.80,21.50%,No,https://m.media-amazon.com/images/I/71HHiiQON7L._AC_UL320_.jpg,13,4.0 de 5 estrellas
